{
  "$schema": "./schemas/state-machine.schema.json",
  "kind": "autoprompt-state-machine",
  "contractVersion": "2.0.0",
  "initialState": "BOOT",
  "terminalStates": [
    "DONE",
    "PARTIAL",
    "BLOCKED",
    "CANCELLED",
    "FAILED"
  ],
  "resumableStates": [
    "CONFIG_REQUIRED",
    "PAUSED",
    "WAITING_USER"
  ],
  "states": [
    "BOOT",
    "LOAD_SKILL",
    "STORE_REQUEST_ENVELOPE",
    "RESOLVE_SETTINGS",
    "CONFIG_REQUIRED",
    "ACQUIRE_TARGET_LOCK",
    "SELECT_SAFE_RUN_ROOT",
    "CREATE_RUN_RECORD",
    "CHECK_PROVIDER_CAPABILITIES",
    "START_ROUTE_ANALYST",
    "SAVE_ROUTE_ANALYSIS",
    "L0_ROUTE_DECISION",
    "WAITING_USER",
    "PREPARE_WORK",
    "RUN_WORK",
    "ITEM_VERIFIED",
    "CHECK_WORK",
    "REPAIRING",
    "CHECK_INCONCLUSIVE",
    "WORKER_CONTEXT_LOST",
    "INTEGRATION_CONFLICT",
    "REASSESS_STRATEGY",
    "CHANGING_ROUTE",
    "APPEND_REQUEST_STEERING",
    "INVALIDATE_AFFECTED_RESULTS",
    "MIGRATING_CONTRACT",
    "RESUME_EXACT_STATE",
    "FINAL_CHECK",
    "FINALIZING",
    "RELEASING_LOCK",
    "PAUSED",
    "DONE",
    "PARTIAL",
    "BLOCKED",
    "CANCELLED",
    "FAILED"
  ],
  "outcomeSchema": "agents/contracts/schemas/outcome.schema.json",
  "eventSchema": "agents/contracts/schemas/state-event.schema.json",
  "eventRecordRequiredFields": [
    "contractVersion",
    "transitionId",
    "eventId",
    "runId",
    "activationNonce",
    "sequence",
    "fromState",
    "toState",
    "requestEnvelopeHash",
    "targetIdentityHash",
    "candidateHash",
    "evidenceHashes",
    "openIds",
    "attempt",
    "causalParent",
    "occurredAt",
    "humanDescription"
  ],
  "transitions": [
    {
      "id": "T001",
      "event": "BOOTSTRAP",
      "from": "BOOT",
      "to": "LOAD_SKILL",
      "guard": "explicit activation capability is present",
      "effect": "load the pinned product contract"
    },
    {
      "id": "T002",
      "event": "SKILL_LOADED",
      "from": "LOAD_SKILL",
      "to": "STORE_REQUEST_ENVELOPE",
      "guard": "product contract digest matches the activation",
      "effect": "prepare immutable request storage"
    },
    {
      "id": "T003",
      "event": "REQUEST_ENVELOPE_STORED",
      "from": "STORE_REQUEST_ENVELOPE",
      "to": "RESOLVE_SETTINGS",
      "guard": "ordered entries and object hashes validate",
      "effect": "resolve supported settings by precedence"
    },
    {
      "id": "T004",
      "event": "SETTINGS_MISSING",
      "from": "RESOLVE_SETTINGS",
      "to": "CONFIG_REQUIRED",
      "guard": "a required supported setting has no allowed source",
      "effect": "start no inspection or worker"
    },
    {
      "id": "T005",
      "event": "SETTINGS_SUPPLIED",
      "from": "CONFIG_REQUIRED",
      "to": "RESOLVE_SETTINGS",
      "guard": "the new value is appended to the exact request record",
      "effect": "revalidate all settings"
    },
    {
      "id": "T006",
      "event": "SETTINGS_RESOLVED",
      "from": "RESOLVE_SETTINGS",
      "to": "ACQUIRE_TARGET_LOCK",
      "guard": "effective numeric limits and user pins validate",
      "effect": "attempt one target lease"
    },
    {
      "id": "T007",
      "event": "TARGET_LOCK_ACQUIRED",
      "from": "ACQUIRE_TARGET_LOCK",
      "to": "SELECT_SAFE_RUN_ROOT",
      "guard": "lease identity is bound to activation and target",
      "effect": "select project history or a private side location"
    },
    {
      "id": "T008",
      "event": "TARGET_LOCK_CONFLICT",
      "from": "ACQUIRE_TARGET_LOCK",
      "to": "BLOCKED",
      "guard": "another live owner holds the target lease",
      "effect": "touch no target or run file"
    },
    {
      "id": "T009",
      "event": "RUN_ROOT_SELECTED",
      "from": "SELECT_SAFE_RUN_ROOT",
      "to": "CREATE_RUN_RECORD",
      "guard": "no-follow containment and target-effect checks pass",
      "effect": "create one run directory atomically"
    },
    {
      "id": "T010",
      "event": "RUN_RECORD_UNSAFE",
      "from": "SELECT_SAFE_RUN_ROOT",
      "to": "RELEASING_LOCK",
      "guard": "neither project history nor a private side location is proven safe",
      "effect": "prepare BLOCKED outcome"
    },
    {
      "id": "T011",
      "event": "RUN_RECORD_CREATED",
      "from": "CREATE_RUN_RECORD",
      "to": "CHECK_PROVIDER_CAPABILITIES",
      "guard": "required files are atomic and the opened directory identity is bound",
      "effect": "compare required effects to verified provider support"
    },
    {
      "id": "T012",
      "event": "RUN_RECORD_FAILURE",
      "from": "CREATE_RUN_RECORD",
      "to": "RELEASING_LOCK",
      "guard": "an atomic write, sync, hash, or state write failed",
      "effect": "preserve last valid state and prepare FAILED outcome"
    },
    {
      "id": "T013",
      "event": "PROVIDER_CAPABILITIES_ACCEPTED",
      "from": "CHECK_PROVIDER_CAPABILITIES",
      "to": "START_ROUTE_ANALYST",
      "guard": "every required feature is verified or has an accepted safe reduced behavior",
      "effect": "start exactly one read-only analyst"
    },
    {
      "id": "T079",
      "event": "EXACT_PATH_ACCEPTED",
      "from": "CHECK_PROVIDER_CAPABILITIES",
      "to": "PREPARE_WORK",
      "guard": "the optional user path is exact, schema-valid, capability-safe, and immutable",
      "effect": "persist the exact route decision and bypass route-analysis and route-selection model work"
    },
    {
      "id": "T014",
      "event": "PROVIDER_UNSUPPORTED",
      "from": "CHECK_PROVIDER_CAPABILITIES",
      "to": "RELEASING_LOCK",
      "guard": "a required feature is unsupported or unverified without safe reduced behavior",
      "effect": "prepare BLOCKED outcome before production work"
    },
    {
      "id": "T015",
      "event": "ROUTE_ANALYST_STARTED",
      "from": "START_ROUTE_ANALYST",
      "to": "SAVE_ROUTE_ANALYSIS",
      "guard": "analyst count is one and its target is read-only",
      "effect": "stream raw events into the transcript"
    },
    {
      "id": "T016",
      "event": "ROUTE_ANALYST_FAILED_TO_START",
      "from": "START_ROUTE_ANALYST",
      "to": "SAVE_ROUTE_ANALYSIS",
      "guard": "failure details are available",
      "effect": "save the failure and continue with lower confidence"
    },
    {
      "id": "T017",
      "event": "ROUTE_ANALYSIS_SAVED",
      "from": "SAVE_ROUTE_ANALYSIS",
      "to": "L0_ROUTE_DECISION",
      "guard": "raw events or a typed failure and bounded index are durable",
      "effect": "give the run owner the recommendation and bounded index"
    },
    {
      "id": "T018",
      "event": "ROUTE_DECISION_VALID",
      "from": "L0_ROUTE_DECISION",
      "to": "PREPARE_WORK",
      "guard": "decision schema, route reasons, success list, and planned checks validate",
      "effect": "prepare only the selected route"
    },
    {
      "id": "T019",
      "event": "ROUTE_DECISION_NEEDS_USER",
      "from": "L0_ROUTE_DECISION",
      "to": "WAITING_USER",
      "guard": "one indispensable user-owned choice is named and route is null",
      "effect": "start no worker"
    },
    {
      "id": "T020",
      "event": "ROUTE_DECISION_INVALID_FIRST",
      "from": "L0_ROUTE_DECISION",
      "to": "L0_ROUTE_DECISION",
      "guard": "no earlier correction was attempted",
      "effect": "allow one same-owner schema correction",
      "boundedBy": "invalidCorrectionLimit == 1"
    },
    {
      "id": "T021",
      "event": "ROUTE_DECISION_INVALID_FINAL",
      "from": "L0_ROUTE_DECISION",
      "to": "RELEASING_LOCK",
      "guard": "the one correction was used",
      "effect": "prepare FAILED outcome without production work"
    },
    {
      "id": "T022",
      "event": "ROUTE_DECISION_TIMEOUT",
      "from": "L0_ROUTE_DECISION",
      "to": "RELEASING_LOCK",
      "guard": "the four-minute ceiling ended without a valid decision",
      "effect": "save unresolved facts and prepare FAILED outcome"
    },
    {
      "id": "T023",
      "event": "WORK_PREPARED",
      "from": "PREPARE_WORK",
      "to": "RUN_WORK",
      "guard": "ownership, success items, checks, and route limits validate",
      "effect": "start only ready work"
    },
    {
      "id": "T024",
      "event": "WORK_ITEM_VERIFIED",
      "from": "RUN_WORK",
      "to": "ITEM_VERIFIED",
      "guard": "the item result and its item-level checks share one version id",
      "effect": "record item completion without ending the run"
    },
    {
      "id": "T025",
      "event": "MORE_WORK_READY",
      "from": "ITEM_VERIFIED",
      "to": "RUN_WORK",
      "guard": "another accepted item is ready and ownership is free",
      "effect": "continue selected-route work"
    },
    {
      "id": "T026",
      "event": "ALL_WORK_JOINED",
      "from": [
        "RUN_WORK",
        "ITEM_VERIFIED"
      ],
      "to": "CHECK_WORK",
      "guard": "all required items are joined and one exact version is frozen",
      "effect": "start independent checks"
    },
    {
      "id": "T027",
      "event": "IMPLEMENTATION_DEFECT",
      "from": "CHECK_WORK",
      "to": "REPAIRING",
      "guard": "a failing assertion, changed behavior, or exact diff fault identifies production work",
      "effect": "return affected work to the same useful worker"
    },
    {
      "id": "T028",
      "event": "MISSING_EDGE_CASE",
      "from": "CHECK_WORK",
      "to": "REPAIRING",
      "guard": "the missing boundary follows from the exact request",
      "effect": "add a regression check and repair the affected work"
    },
    {
      "id": "T029",
      "event": "REGRESSION",
      "from": "CHECK_WORK",
      "to": "REPAIRING",
      "guard": "a recorded pre-change passing check is now failing",
      "effect": "repair or revert the affected change"
    },
    {
      "id": "T030",
      "event": "CHECK_DEFECT",
      "from": "CHECK_WORK",
      "to": "REPAIRING",
      "guard": "the check cannot run or measures the wrong target",